[
  {
    "name": "tree",
    "iconUrl": "./assets/resources/tree.jpg",
    "terrains": [
      {
        "types": [
          "Grasslands",
          "FootHills"
        ],
        "modelUrls": [
          "./assets/resources/trees/round/tree_01.glb",
          "./assets/resources/trees/round/tree_02.glb",
          "./assets/resources/trees/round/tree_03.glb"
        ],
        "quantity": {
          "min": 1,
          "max": 3
        },
        "probability": {
          "base": 0.1,
          "adjacent": 0.2
        },
        "size": 2,
        "sizeVariance": 0.25
      },
      {
        "types": [
          "Tundra"
        ],
        "modelUrls": [
          "./assets/resources/trees/pine/pine_01.glb",
          "./assets/resources/trees/pine/pine_02.glb",
          "./assets/resources/trees/pine/pine_03.glb",
          "./assets/resources/trees/pine/pine_04.glb",
          "./assets/resources/trees/pine/pine_05.glb",
          "./assets/resources/trees/pine/pine_06.glb",
          "./assets/resources/trees/pine/pine_07.glb",
          "./assets/resources/trees/pine/pine_08.glb",
          "./assets/resources/trees/pine/pine_09.glb",
          "./assets/resources/trees/pine/pine_10.glb"
        ],
        "quantity": {
          "min": 2,
          "max": 5
        },
        "probability": {
          "base": 0.08,
          "adjacent": 0.12
        },
        "size": 2,
        "sizeVariance": 0.1
      }
    ],
    "improvement": {
      "lumberMill": {
        "type": "wood",
        "yieldMultiplier": 1.1
      }
    }
  },
  {
    "name": "gold",
    "iconUrl": "./assets/resources/gold.png",
    "terrains": [
      {
        "types": [
          "Hills",
          "Mountains",
          "SnowyMountains"
        ],
        "modelUrls": [
          "./assets/resources/gold.glb"
        ],
        "quantity": {
          "min": 1,
          "max": 3
        },
        "probability": {
          "base": 0.1,
          "adjacent": 0
        },
        "size": 0.6,
        "sizeVariance": 0.1
      }
    ],
    "improvement": {
      "mine": {
        "type": "gold",
        "yieldMultiplier": 1.5
      }
    }
  },
  {
    "name": "iron",
    "iconUrl": "./assets/resources/iron.png",
    "terrains": [
      {
        "types": [
          "Hills",
          "Mountains",
          "SnowyMountains"
        ],
        "modelUrls": [
          "./assets/resources/iron.glb"
        ],
        "quantity": {
          "min": 1,
          "max": 3
        },
        "probability": {
          "base": 0.1,
          "adjacent": 0
        },
        "size": 0.6,
        "sizeVariance": 0.1
      }
    ],
    "improvement": {
      "forge": {
        "type": "iron",
        "yieldMultiplier": 1.5
      }
    }
  },
  {
    "name": "deer",
    "iconUrl": "./assets/resources/deer.png",
    "terrains": [
      {
        "types": [
          "Grasslands",
          "FootHills"
        ],
        "modelUrls": [
          "./assets/resources/deer.glb"
        ],
        "quantity": {
          "min": 1,
          "max": 2
        },
        "probability": {
          "base": 0.05,
          "adjacent": 0
        },
        "size": 0.8,
        "sizeVariance": 0.1
      }
    ],
    "improvement": {
      "village": {
        "type": "food",
        "yieldMultiplier": 1.3
      }
    }
  },
  {
    "name": "bison",
    "iconUrl": "./assets/resources/bison.png",
    "terrains": [
      {
        "types": [
          "Grasslands",
          "Tundra"
        ],
        "modelUrls": [
          "./assets/resources/bison.glb"
        ],
        "quantity": {
          "min": 1,
          "max": 2
        },
        "probability": {
          "base": 0.05,
          "adjacent": 0
        },
        "size": 1,
        "sizeVariance": 0.1
      }
    ],
    "improvement": {
      "village": {
        "type": "food",
        "yieldMultiplier": 1.4
      }
    }
  },
  {
    "name": "crab",
    "iconUrl": "./assets/resources/crab.png",
    "terrains": [
      {
        "types": [
          "ShallowWater"
        ],
        "modelUrls": [
          "./assets/resources/crab.glb"
        ],
        "quantity": {
          "min": 1,
          "max": 2
        },
        "probability": {
          "base": 0.08,
          "adjacent": 0.1
        },
        "size": 0.7,
        "sizeVariance": 0.1
      }
    ],
    "improvement": {
      "village": {
        "type": "food",
        "yieldMultiplier": 1.2
      }
    }
  },
  {
    "name": "gems",
    "iconUrl": "./assets/resources/gems.png",
    "terrains": [
      {
        "types": [
          "Mountains",
          "SnowyMountains"
        ],
        "modelUrls": [
          "./assets/resources/gems.glb"
        ],
        "quantity": {
          "min": 2,
          "max": 2
        },
        "probability": {
          "base": 0.05,
          "adjacent": 0
        },
        "size": 0.4,
        "sizeVariance": 0.2
      }
    ],
    "improvement": {
      "mine": {
        "type": "gems",
        "yieldMultiplier": 1.4
      }
    }
  }
]